{"$defs":{"MrResourceTier":{"description":"Reviewed first-attempt workload tier.","enum":["standard","heavy","very_heavy"],"title":"MrResourceTier","type":"string"}},"$id":"https://example.org/genome-to-diffraction/generated/mr-resource-plan.schema.json","$schema":"https://json-schema.org/draft/2020-12/schema","additionalProperties":false,"description":"Content-addressed first-attempt resources and bounded retry policy.","properties":{"adapter_version":{"const":"phase3-mr-resource-allocation-v1","default":"phase3-mr-resource-allocation-v1","title":"Adapter Version","type":"string"},"base_cpus":{"exclusiveMinimum":0,"title":"Base Cpus","type":"integer"},"base_memory_gb":{"exclusiveMinimum":0,"title":"Base Memory Gb","type":"integer"},"base_time_hours":{"exclusiveMinimum":0,"title":"Base Time Hours","type":"integer"},"coordinate_atom_workload":{"exclusiveMinimum":0,"title":"Coordinate Atom Workload","type":"integer"},"fixed_atom_count":{"minimum":0,"title":"Fixed Atom Count","type":"integer"},"formula":{"const":"reflection_count*(moving_atoms*searched_copies+fixed_atoms)*min(symmetry_multiplicity,8)","default":"reflection_count*(moving_atoms*searched_copies+fixed_atoms)*min(symmetry_multiplicity,8)","title":"Formula","type":"string"},"heavy_max_score":{"const":10000000000,"default":10000000000,"title":"Heavy Max Score","type":"integer"},"max_cpus":{"const":16,"default":16,"title":"Max Cpus","type":"integer"},"max_memory_gb":{"const":64,"default":64,"title":"Max Memory Gb","type":"integer"},"max_retries":{"const":1,"default":1,"title":"Max Retries","type":"integer"},"max_time_hours":{"const":48,"default":48,"title":"Max Time Hours","type":"integer"},"moving_atom_count":{"exclusiveMinimum":0,"title":"Moving Atom Count","type":"integer"},"owner_id":{"minLength":1,"title":"Owner Id","type":"string"},"owner_kind":{"enum":["mr_hypothesis","component_execution_input"],"title":"Owner Kind","type":"string"},"reflection_count":{"exclusiveMinimum":0,"title":"Reflection Count","type":"integer"},"resource_plan_id":{"pattern":"^mrresource_[a-f0-9]{64}$","title":"Resource Plan Id","type":"string"},"retry_scaling":{"const":"linear_task_attempt","default":"linear_task_attempt","title":"Retry Scaling","type":"string"},"retryable_exit_status_policy":{"const":"75,104,130-145,175-177","default":"75,104,130-145,175-177","title":"Retryable Exit Status Policy","type":"string"},"retryable_failure_classes":{"default":["transient_infrastructure","scheduler_resource_or_interruption"],"maxItems":2,"minItems":2,"prefixItems":[{"const":"transient_infrastructure","type":"string"},{"const":"scheduler_resource_or_interruption","type":"string"}],"title":"Retryable Failure Classes","type":"array"},"schema_version":{"const":"2.0","title":"Schema Version","type":"string"},"searched_copy_count":{"exclusiveMinimum":0,"title":"Searched Copy Count","type":"integer"},"standard_max_score":{"const":1000000000,"default":1000000000,"title":"Standard Max Score","type":"integer"},"symmetry_cost_factor":{"exclusiveMinimum":0,"maximum":8,"title":"Symmetry Cost Factor","type":"integer"},"symmetry_multiplicity":{"exclusiveMinimum":0,"title":"Symmetry Multiplicity","type":"integer"},"tier":{"$ref":"#/$defs/MrResourceTier"},"workload_score":{"exclusiveMinimum":0,"title":"Workload Score","type":"integer"}},"required":["schema_version","resource_plan_id","owner_kind","owner_id","reflection_count","moving_atom_count","searched_copy_count","fixed_atom_count","symmetry_multiplicity","symmetry_cost_factor","coordinate_atom_workload","workload_score","tier","base_cpus","base_memory_gb","base_time_hours"],"title":"MrResourcePlan","type":"object"}
