{"adapter_version":"phase3-mr-resource-allocation-v1","base_cpus":4,"base_memory_gb":16,"base_time_hours":12,"coordinate_atom_workload":100,"fixed_atom_count":0,"formula":"reflection_count*(moving_atoms*searched_copies+fixed_atoms)*min(symmetry_multiplicity,8)","heavy_max_score":10000000000,"max_cpus":16,"max_memory_gb":64,"max_retries":1,"max_time_hours":48,"moving_atom_count":100,"owner_id":"mrhyp_aaaaaaaaaaaaaaaaaaaaaaaaaaaaaaaaaaaaaaaaaaaaaaaaaaaaaaaaaaaaaaaa","owner_kind":"mr_hypothesis","reflection_count":1000,"resource_plan_id":"mrresource_7c1c10e6f583530e68a25f10798d87eb1dca81187875d5c7d358547f77f6d7ad","retry_scaling":"linear_task_attempt","retryable_exit_status_policy":"75,104,130-145,175-177","retryable_failure_classes":["transient_infrastructure","scheduler_resource_or_interruption"],"schema_version":"2.0","searched_copy_count":1,"standard_max_score":1000000000,"symmetry_cost_factor":1,"symmetry_multiplicity":1,"tier":"standard","workload_score":100000}
